<!DOCTYPE layout SYSTEM "layout.dtd">

<layout width="1024" height="768">
 <columns>
   <rows size="400">
      <widget size="300" name="strips"/>
<!--      <widget size="300" name="plugin"/> -->
      <widget name="alarms"/>
   </rows>
   <rows>
     <widget name="map2d"/>
     <widget name="aircraft"/>
   </rows>
 </columns>
</layout>
